{
  "version": "1.0",
  "generated_at": "2026-08-18T00:19:40Z",
  "source": "manual-demo",
  "policies": [
    {
      "id": "P-NDRC-20260519-0001",
      "title": "《关于支持多用户绿色电力直接接入电网的通知》",
      "department": "国家发改委",
      "doc_number": "发改能源〔2026〕688号",
      "publish_date": "2026-05-19",
      "effective_date": "2026-07-01",
      "category": "policy",
      "scope": [
        "compute",
        "monitor"
      ],
      "priority": 1,
      "summary": "推动多用户绿电直连数据中心,降低算力中心用电成本与碳排放。",
      "key_points": [
        "绿电直供",
        "降本",
        "碳核算"
      ],
      "source_url": "https://www.ndrc.gov.cn/xxgk/zcfb/tz/202605/t20260519_138000.html",
      "captured_at": "2026-08-19T08:30:00Z",
      "captured_by": "manual-demo",
      "tags": [
        "绿电",
        "直连",
        "数据中心"
      ],
      "review_status": "pending"
    },
    {
      "id": "P-NDRC-20260603-0002",
      "title": "《城市公共供水管网漏损治理实施方案(2026-2030)》",
      "department": "国家发改委",
      "doc_number": "发改农经〔2026〕812号",
      "publish_date": "2026-06-03",
      "effective_date": "2026-09-01",
      "category": "policy",
      "scope": [
        "water",
        "monitor"
      ],
      "priority": 2,
      "summary": "推进城市供水管网 DMA 分区计量与漏损治理,要求 2030 年公共供水管网漏损率降至 8% 以内。",
      "key_points": [
        "DMA 分区计量",
        "漏损率",
        "智慧水务"
      ],
      "source_url": "https://www.ndrc.gov.cn/xxgk/zcfb/tz/202606/t20260603_139100.html",
      "captured_at": "2026-08-19T08:30:00Z",
      "captured_by": "manual-demo",
      "tags": [
        "供水",
        "漏损",
        "DMA"
      ],
      "review_status": "pending"
    },
    {
      "id": "P-NDRC-20260618-0003",
      "title": "《关于加快推进 5G 专网在能源行业应用的通知》",
      "department": "国家发改委",
      "doc_number": "发改高技〔2026〕1024号",
      "publish_date": "2026-06-18",
      "effective_date": "2026-08-01",
      "category": "policy",
      "scope": [
        "telecom",
        "grid",
        "monitor"
      ],
      "priority": 2,
      "summary": "鼓励电网、油气管网部署 5G 专网,支持 5G+ 能源监测融合应用。",
      "key_points": [
        "5G 专网",
        "频谱",
        "能源监测"
      ],
      "source_url": "https://www.ndrc.gov.cn/xxgk/zcfb/tz/202606/t20260618_140200.html",
      "captured_at": "2026-08-19T08:30:00Z",
      "captured_by": "manual-demo",
      "tags": [
        "5G",
        "专网",
        "能源"
      ],
      "review_status": "pending"
    },
    {
      "id": "P-NDRC-20260705-0004",
      "title": "《城镇燃气管网更新改造 2026 年度中央预算内投资计划》",
      "department": "国家发改委",
      "doc_number": "发改投资〔2026〕1107号",
      "publish_date": "2026-07-05",
      "effective_date": "2026-07-15",
      "category": "price",
      "scope": [
        "pipe",
        "monitor"
      ],
      "priority": 1,
      "summary": "下达 2026 年度中央预算内投资 280 亿元,支持城镇燃气老旧管网更新改造与智慧监测。",
      "key_points": [
        "中央预算",
        "燃气管网",
        "改造投资"
      ],
      "source_url": "https://www.ndrc.gov.cn/xxgk/zcfb/tz/202607/t20260705_141300.html",
      "captured_at": "2026-08-19T08:30:00Z",
      "captured_by": "manual-demo",
      "tags": [
        "燃气",
        "管网改造",
        "投资"
      ],
      "review_status": "pending"
    },
    {
      "id": "P-NDRC-20260722-0005",
      "title": "《多式联运高质量发展中长期行动方案》",
      "department": "国家发改委",
      "doc_number": "发改基础〔2026〕1198号",
      "publish_date": "2026-07-22",
      "effective_date": "2026-09-01",
      "category": "policy",
      "scope": [
        "logi",
        "monitor"
      ],
      "priority": 2,
      "summary": "推动公铁/铁水/空铁多式联运信息互联互通,建设国家级多式联运公共数据平台。",
      "key_points": [
        "多式联运",
        "信息互联",
        "公共数据平台"
      ],
      "source_url": "https://www.ndrc.gov.cn/xxgk/zcfb/tz/202607/t20260722_142400.html",
      "captured_at": "2026-08-19T08:30:00Z",
      "captured_by": "manual-demo",
      "tags": [
        "多式联运",
        "物流",
        "数据平台"
      ],
      "review_status": "pending"
    },
    {
      "id": "P-NDRC-20260802-0006",
      "title": "《重要能源商品价格监测预警工作规则(试行)》",
      "department": "国家发改委",
      "doc_number": "发改价格〔2026〕1256号",
      "publish_date": "2026-08-02",
      "effective_date": "2026-09-15",
      "category": "monitor",
      "scope": [
        "monitor",
        "grid"
      ],
      "priority": 1,
      "summary": "建立煤、电、油、气、新能源全品种价格监测预警机制,周报频次升级为日报。",
      "key_points": [
        "价格监测",
        "日报",
        "预警阈值"
      ],
      "source_url": "https://www.ndrc.gov.cn/xxgk/zcfb/tz/202608/t20260802_143500.html",
      "captured_at": "2026-08-19T08:30:00Z",
      "captured_by": "manual-demo",
      "tags": [
        "价格监测",
        "预警",
        "能源"
      ],
      "review_status": "pending"
    },
    {
      "id": "P-NDRC-20260812-0007",
      "title": "《新型数据中心算力计量与运行监测技术规范》",
      "department": "国家发改委",
      "doc_number": "发改高技〔2026〕1302号",
      "publish_date": "2026-08-12",
      "effective_date": "2026-11-01",
      "category": "standard",
      "scope": [
        "compute",
        "monitor"
      ],
      "priority": 3,
      "summary": "明确数据中心算力计量单位、能效指标(PUE)、运行监测数据上报频次与接口规范。",
      "key_points": [
        "算力计量",
        "PUE",
        "监测接口"
      ],
      "source_url": "https://www.ndrc.gov.cn/xxgk/zcfb/tz/202608/t20260812_144600.html",
      "captured_at": "2026-08-19T08:30:00Z",
      "captured_by": "manual-demo",
      "tags": [
        "数据中心",
        "PUE",
        "算力计量"
      ],
      "review_status": "pending"
    },
    {
      "id": "P-NDRC-20260818-0001",
      "title": "《关于算电协同六网融合的指导意见（示范版）》",
      "department": "国家发改委",
      "doc_number": "发改能源〔2026〕999号",
      "publish_date": "2026-08-18",
      "effective_date": "2026-09-01",
      "category": "policy",
      "scope": [
        "compute",
        "grid",
        "monitor"
      ],
      "priority": 1,
      "summary": "推动算力、电力、数据等多网融合，构建新型基础设施体系。",
      "key_points": [
        "算电协同",
        "六网融合",
        "示范先行"
      ],
      "source_url": "https://www.ndrc.gov.cn/demo/202608/t20260818_demo.html",
      "captured_at": "2026-08-18T08:30:00Z",
      "captured_by": "integrate-demo-v1.0",
      "tags": [
        "算电协同",
        "六网"
      ],
      "review_status": "pending"
    },
    {
      "id": "P-MWR-20260817-0002",
      "title": "《城市供水管网 DMA 分区计量推广方案》",
      "department": "水利部",
      "doc_number": "水规计〔2026〕88号",
      "publish_date": "2026-08-17",
      "effective_date": "2026-10-01",
      "category": "policy",
      "scope": [
        "water",
        "monitor"
      ],
      "priority": 2,
      "summary": "推广 DMA 分区计量，目标 2030 漏损率 < 8%。",
      "key_points": [
        "DMA 分区",
        "漏损治理"
      ],
      "source_url": "https://www.mwr.gov.cn/demo/202608/t20260817_demo.html",
      "captured_at": "2026-08-18T08:30:00Z",
      "captured_by": "integrate-demo-v1.0",
      "tags": [
        "供水",
        "DMA"
      ],
      "review_status": "pending"
    },
    {
      "id": "P-MIIT-20260816-0003",
      "title": "《数据中心绿电直供实施细则》",
      "department": "工信部",
      "doc_number": "工信部节〔2026〕77号",
      "publish_date": "2026-08-16",
      "effective_date": "2026-09-15",
      "category": "policy",
      "scope": [
        "compute",
        "grid"
      ],
      "priority": 1,
      "summary": "明确数据中心绿电直供的并网、计量、碳核算流程。",
      "key_points": [
        "绿电直供",
        "并网",
        "碳核算"
      ],
      "source_url": "https://www.miit.gov.cn/demo/202608/t20260816_demo.html",
      "captured_at": "2026-08-18T08:30:00Z",
      "captured_by": "integrate-demo-v1.0",
      "tags": [
        "数据中心",
        "绿电"
      ],
      "review_status": "pending"
    },
    {
      "id": "P-MIIT-20260815-0004",
      "title": "《5G+工业互联网融合应用指南》",
      "department": "工信部",
      "doc_number": "工信部信管〔2026〕66号",
      "publish_date": "2026-08-15",
      "effective_date": "2026-09-01",
      "category": "policy",
      "scope": [
        "telecom"
      ],
      "priority": 3,
      "summary": "5G + 工业互联网在六大行业的落地路径。",
      "key_points": [
        "5G",
        "工业互联网"
      ],
      "source_url": "https://www.miit.gov.cn/demo/202608/t20260815_demo.html",
      "captured_at": "2026-08-18T08:30:00Z",
      "captured_by": "integrate-demo-v1.0",
      "tags": [
        "5G",
        "工业"
      ],
      "review_status": "pending"
    },
    {
      "id": "P-NDRC-20260814-0005",
      "title": "《国家级算力枢纽节点建设方案》",
      "department": "国家发改委",
      "doc_number": "发改高技〔2026〕55号",
      "publish_date": "2026-08-14",
      "effective_date": "2026-10-01",
      "category": "policy",
      "scope": [
        "compute",
        "monitor"
      ],
      "priority": 1,
      "summary": "8 个国家级算力枢纽节点布局，明确 PUE、绿电比例要求。",
      "key_points": [
        "算力枢纽",
        "PUE",
        "绿电"
      ],
      "source_url": "https://www.ndrc.gov.cn/demo/202608/t20260814_demo.html",
      "captured_at": "2026-08-18T08:30:00Z",
      "captured_by": "integrate-demo-v1.0",
      "tags": [
        "算力枢纽",
        "PUE"
      ],
      "review_status": "pending"
    },
    {
      "id": "P-NEA-20240415-3621",
      "title": "《电力领域综合监管工作通知》",
      "department": "国家能源局",
      "doc_number": "国能发监管〔2024〕45号",
      "publish_date": "2024-04-15",
      "effective_date": "2024-04-15",
      "category": "policy",
      "scope": [
        "grid",
        "monitor"
      ],
      "priority": 1,
      "summary": "《电力领域综合监管工作通知》",
      "key_points": [],
      "source_url": "https://www.nea.gov.cn/2024-0415/news_20240415_1001.html",
      "captured_at": "2026-08-18T00:16:11.840971Z",
      "captured_by": "nea-fetcher-v0.1",
      "tags": [],
      "review_status": "pending"
    },
    {
      "id": "P-NEA-20240509-1134",
      "title": "《新能源消纳监测预警管理办法(试行)》",
      "department": "国家能源局",
      "doc_number": "国能发新能〔2024〕62号",
      "publish_date": "2024-05-09",
      "effective_date": "2024-05-09",
      "category": "policy",
      "scope": [
        "grid",
        "monitor"
      ],
      "priority": 1,
      "summary": "《新能源消纳监测预警管理办法(试行)》",
      "key_points": [],